{
  "$schema": "https://json-schema.org/draft/2020-12/schema",
  "$id": "https://superb.app/schema/source.schema.json",
  "title": "Sourced excerpt",
  "description": "A cited public-domain excerpt. See docs/seams.md §Seam 2. Provenance is complete or the row does not exist — every field below is required, no exceptions (law 4, ADR-008). `topic` is required per ADR-022 (workspace/decisions/README.md): the engine's topic-affinity table looks up a topic for every passage id it finished or abandoned, sourced or composed, so a sourced excerpt with no topic is one the recommender cannot learn from.",
  "type": "object",
  "additionalProperties": false,
  "required": ["id", "pool", "topic", "text", "words", "provenance"],
  "properties": {
    "id": {
      "type": "string",
      "pattern": "^src-[a-z0-9]+(-[a-z0-9]+)*$",
      "description": "Stable id, e.g. src-melville-0031."
    },
    "pool": {
      "const": "sourced"
    },
    "topic": {
      "type": "string",
      "minLength": 1,
      "description": "The topic cluster this excerpt belongs to, e.g. sea. Same open vocabulary as passage.schema.json's topic field."
    },
    "text": {
      "type": "string",
      "minLength": 1,
      "description": "The excerpt itself, 80-200 words."
    },
    "words": {
      "type": "array", "minItems": 1,
      "items": {
        "type": "object", "additionalProperties": false,
        "required": ["word", "signals"],
        "properties": {
          "word":    { "type": "string", "minLength": 1 },
          "signals": {
            "type": "array", "minItems": 1, "uniqueItems": true,
            "items": { "enum": ["apposition", "definition-marker", "gloss-overlap", "hand-picked"] }
          }
        }
      },
      "description": "Only the words the excerpt carries in informative context — not every word present. Each word carries the signal class(es) that claimed it (ADR-026, workspace/decisions/README.md) so contamination is auditable rather than silent."
    },
    "provenance": {
      "type": "object",
      "additionalProperties": false,
      "required": ["work", "author", "year", "source", "url", "licence", "retrieved"],
      "properties": {
        "work": { "type": "string", "minLength": 1 },
        "author": { "type": "string", "minLength": 1 },
        "year": { "type": "integer" },
        "source": { "type": "string", "minLength": 1 },
        "url": { "type": "string", "format": "uri" },
        "licence": { "type": "string", "minLength": 1 },
        "retrieved": { "type": "string", "format": "date" }
      }
    }
  }
}
