{
  "id": "src-gen-middlemarch-032",
  "pool": "sourced",
  "text": "Neither of them knew how long they stood in that way. Dorothea was raising her eyes, and was about to speak, when the door opened and her footman came to say— “The horses are ready, madam, whenever you like to start.” “Presently,” said Dorothea. Then turning to Will, she said, “I have some memoranda to write for the housekeeper.” “I must go,” said Will, when the door had closed again—advancing towards her. “The day after to-morrow I shall leave Middlemarch.” “You have acted in every way rightly,” said Dorothea, in a low tone, feeling a pressure at her heart which made it difficult to speak. She put out her hand, and Will took it for an instant without speaking, for her words had seemed to him cruelly cold and unlike herself.",
  "words": [
    {
      "word": "morrow",
      "signals": [
        "gloss-overlap"
      ]
    }
  ],
  "provenance": {
    "work": "Middlemarch",
    "author": "George Eliot",
    "year": 1871,
    "source": "Project Gutenberg #145",
    "url": "https://www.gutenberg.org/ebooks/145.txt.utf-8",
    "licence": "Public Domain (US: published before 1929)",
    "retrieved": "2026-07-25"
  },
  "topic": "society"
}
