{
  "id": "src-gen-the-picture-of-dorian-gray-040",
  "pool": "sourced",
  "text": "“‘Like the painting of a sorrow,’” he repeated, “‘a face without a heart.’” The elder man lay back and looked at him with half-closed eyes. “By the way, Dorian,” he said after a pause, “‘what does it profit a man if he gain the whole world and lose—how does the quotation run?—his own soul’?” The music jarred, and Dorian Gray started and stared at his friend. “Why do you ask me that, Harry?” “My dear fellow,” said Lord Henry, elevating his eyebrows in surprise, “I asked you because I thought you might be able to give me an answer. That is all. I was going through the park last Sunday, and close by the Marble Arch there stood a little crowd of shabby-looking people listening to some vulgar street-preacher.",
  "words": [
    {
      "word": "quotation",
      "signals": [
        "gloss-overlap"
      ]
    }
  ],
  "provenance": {
    "work": "The Picture of Dorian Gray",
    "author": "Oscar Wilde",
    "year": 1890,
    "source": "Project Gutenberg #174",
    "url": "https://www.gutenberg.org/ebooks/174.txt.utf-8",
    "licence": "Public Domain (US: published before 1929)",
    "retrieved": "2026-07-25"
  },
  "topic": "supernatural"
}
