{
  "id": "src-gen-king-solomon-s-mines-033",
  "pool": "sourced",
  "text": "As we drew near we perceived that they were Colossi of some sort or another, and rightly conjectured that before us sat the three “Silent Ones” that are held in such awe by the Kukuana people. But it was not until we were quite close to them that we recognised the full majesty of these “Silent Ones.” There, upon huge pedestals of dark rock, sculptured with rude emblems of the Phallic worship, separated from each other by a distance of forty paces, and looking down the road which crossed some sixty miles of plain to Loo, were three colossal seated forms—two male and one female—each measuring about thirty feet from the crown of its head to the pedestal. The female form, which was nude, was of great though severe beauty, but unfortunately the features had been injured by centuries of exposure to the weather. Rising from either side of her head were the points of a crescent. The two male Colossi, on the contrary, were draped, and presented a terrifying cast of features, especially the one to our right, which had the face of a devil.",
  "words": [
    {
      "word": "rightly",
      "signals": [
        "gloss-overlap"
      ]
    },
    {
      "word": "majesty",
      "signals": [
        "gloss-overlap"
      ]
    },
    {
      "word": "colossal",
      "signals": [
        "gloss-overlap"
      ]
    },
    {
      "word": "nude",
      "signals": [
        "gloss-overlap"
      ]
    },
    {
      "word": "crescent",
      "signals": [
        "gloss-overlap"
      ]
    }
  ],
  "provenance": {
    "work": "King Solomon's Mines",
    "author": "H. Rider Haggard",
    "year": 1885,
    "source": "Project Gutenberg #2166",
    "url": "https://www.gutenberg.org/ebooks/2166.txt.utf-8",
    "licence": "Public Domain (US: published before 1929)",
    "retrieved": "2026-07-25"
  },
  "topic": "travel"
}
