{
  "id": "src-gen-the-mystery-of-the-yellow-room-017",
  "pool": "sourced",
  "text": "The concierge closed the window after him and fastened the blinds, which certainly could not have closed and fastened of themselves. That is the conclusion I have arrived at. If anyone here has any other idea, let him state it.” Monsieur Stangerson intervened:— “What you say was impossible. I do not believe either in the guilt or in the connivance of my concierges, though I cannot understand what they were doing in the park at that late hour of the night. I say it was impossible, because Madame Bernier held the lamp and did not move from the threshold of the room; because I, as soon as the door was forced open, threw myself on my knees beside my daughter, and no one could have left or entered the room by the door, without passing over her body and forcing his way by me!",
  "words": [
    {
      "word": "threshold",
      "signals": [
        "gloss-overlap"
      ]
    },
    {
      "word": "forcing",
      "signals": [
        "gloss-overlap"
      ]
    }
  ],
  "provenance": {
    "work": "The Mystery of the Yellow Room",
    "author": "Gaston Leroux",
    "year": 1907,
    "source": "Project Gutenberg #1685",
    "url": "https://www.gutenberg.org/ebooks/1685.txt.utf-8",
    "licence": "Public Domain (US: published before 1929)",
    "retrieved": "2026-07-25"
  },
  "topic": "mystery"
}
