{
  "id": "src-gen-washington-square-018",
  "pool": "sourced",
  "text": "“Why are you so dry, Catherine?” Mrs. Penniman said at last. “So dry?” “So cold—so irresponsive.” The girl turned very quickly. “Did he say that?” Mrs. Penniman hesitated a moment. “I will tell you what he said. He said he feared only one thing—that you would be afraid.” “Afraid of what?” “Afraid of your father.” Catherine turned back to the fire again, and then, after a pause, she said—“I am afraid of my father.” Mrs. Penniman got quickly up from her chair and approached her niece.",
  "words": [
    {
      "word": "feared",
      "signals": [
        "gloss-overlap"
      ]
    },
    {
      "word": "niece",
      "signals": [
        "gloss-overlap"
      ]
    }
  ],
  "provenance": {
    "work": "Washington Square",
    "author": "Henry James",
    "year": 1880,
    "source": "Project Gutenberg #2870",
    "url": "https://www.gutenberg.org/ebooks/2870.txt.utf-8",
    "licence": "Public Domain (US: published before 1929)",
    "retrieved": "2026-07-25"
  },
  "topic": "society"
}
