{
  "id": "src-gen-the-mysterious-island-009",
  "pool": "sourced",
  "text": "Cyrus Harding had said two hours, but of course that depended on the nature of the obstacles they might meet with. As it was probable that they would have to cut a path through the grass, shrubs, and creepers, they marched axe in hand, and with guns also ready, wisely taking warning from the cries of the wild beasts heard in the night. The exact position of the encampment could be determined by the bearing of Mount Franklin, and as the volcano arose in the north at a distance of less than three miles, they had only to go straight towards the southwest to reach the western coast. They set out, having first carefully secured the canoe. Pencroft and Neb carried sufficient provision for the little band for at least two days.",
  "words": [
    {
      "word": "arose",
      "signals": [
        "gloss-overlap"
      ]
    },
    {
      "word": "southwest",
      "signals": [
        "gloss-overlap"
      ]
    },
    {
      "word": "canoe",
      "signals": [
        "gloss-overlap"
      ]
    }
  ],
  "provenance": {
    "work": "The Mysterious Island",
    "author": "Jules Verne",
    "year": 1874,
    "source": "Project Gutenberg #1268",
    "url": "https://www.gutenberg.org/ebooks/1268",
    "licence": "Public Domain (US: published before 1929)",
    "retrieved": "2026-07-25"
  },
  "topic": "sea"
}
