{
  "id": "src-gen-washington-square-037",
  "pool": "sourced",
  "text": "But I can’t do the pathetic; I can’t pump up tears, to look graceful, over the most fortunate thing that ever happened to her.” “You have no sympathy,” said Mrs. Almond; “that was never your strong point. You have only to look at her to see that, right or wrong, and whether the rupture came from herself or from him, her poor little heart is grievously bruised.” “Handling bruises—and even dropping tears on them—doesn’t make them any better! My business is to see she gets no more knocks, and that I shall carefully attend to. But I don’t at all recognise your description of Catherine. She doesn’t strike me in the least as a young woman going about in search of a moral poultice.",
  "words": [
    {
      "word": "pathetic",
      "signals": [
        "gloss-overlap"
      ]
    }
  ],
  "provenance": {
    "work": "Washington Square",
    "author": "Henry James",
    "year": 1880,
    "source": "Project Gutenberg #2870",
    "url": "https://www.gutenberg.org/ebooks/2870.txt.utf-8",
    "licence": "Public Domain (US: published before 1929)",
    "retrieved": "2026-07-25"
  },
  "topic": "society"
}
