{
  "id": "src-gen-the-mysterious-affair-at-styles-023",
  "pool": "sourced",
  "text": "Now for the real ones. I have ascertained that anyone in the household, with the exception of Mrs. Cavendish, who was playing tennis with you, could have personated Mr. Inglethorp on Monday evening. In the same way, we have his statement that he put the coffee down in the hall. No one took much notice of that at the inquest—but now it has a very different significance. We must find out who did take that coffee to Mrs. Inglethorp eventually, or who passed through the hall whilst it was standing there.",
  "words": [
    {
      "word": "inquest",
      "signals": [
        "gloss-overlap"
      ]
    }
  ],
  "provenance": {
    "work": "The Mysterious Affair at Styles",
    "author": "Agatha Christie",
    "year": 1920,
    "source": "Project Gutenberg #863",
    "url": "https://www.gutenberg.org/ebooks/863.txt.utf-8",
    "licence": "Public Domain (US: published before 1929)",
    "retrieved": "2026-07-25"
  },
  "topic": "mystery"
}
