{
  "id": "src-gen-the-great-god-pan-032",
  "pool": "sourced",
  "text": "The person from whom I got my information, as you may suppose, no great Puritan, shuddered and grew sick in telling me of the nameless infamies which were laid to her charge. After living there for a year, or perhaps a little more, she disappeared as suddenly as she came, and they saw nothing of her till about the time of the Paul Street case. At first she came to her old haunts only occasionally, then more frequently, and finally took up her abode there as before, and remained for six or eight months. It’s of no use my going into details as to the life that woman led; if you want particulars you can look at Meyrick’s legacy. Those designs were not drawn from his imagination.",
  "words": [
    {
      "word": "particulars",
      "signals": [
        "gloss-overlap"
      ]
    }
  ],
  "provenance": {
    "work": "The Great God Pan",
    "author": "Arthur Machen",
    "year": 1894,
    "source": "Project Gutenberg #389",
    "url": "https://www.gutenberg.org/ebooks/389.txt.utf-8",
    "licence": "Public Domain (US: published before 1929)",
    "retrieved": "2026-07-25"
  },
  "topic": "supernatural"
}
