{
  "id": "src-gen-tess-of-the-d-urbervilles-006",
  "pool": "sourced",
  "text": "The eldest of the comers, a girl who wore a triangular shawl, its corner draggling on the stubble, carried in her arms what at first sight seemed to be a doll, but proved to be an infant in long clothes. Another brought some lunch. The harvesters ceased working, took their provisions, and sat down against one of the shocks. Here they fell to, the men plying a stone jar freely, and passing round a cup. Tess Durbeyfield had been one of the last to suspend her labours.",
  "words": [
    {
      "word": "eldest",
      "signals": [
        "gloss-overlap"
      ]
    }
  ],
  "provenance": {
    "work": "Tess of the d'Urbervilles",
    "author": "Thomas Hardy",
    "year": 1891,
    "source": "Project Gutenberg #110",
    "url": "https://www.gutenberg.org/ebooks/110",
    "licence": "Public Domain (Project Gutenberg, US)",
    "retrieved": "2026-07-25"
  },
  "topic": "courtship"
}
