{
  "id": "src-gen-a-christmas-carol-001",
  "pool": "sourced",
  "text": "Good afternoon, gentlemen!\" Seeing clearly that it would be useless to pursue their point, the gentlemen withdrew. Scrooge resumed his labours with an improved opinion of himself, and in a more facetious temper than was usual with him. Meanwhile the fog and darkness thickened so, that people ran about with flaring links, proffering their services to go before horses in carriages, and conduct them on their way. The ancient tower of a church, whose gruff old bell was always peeping slily down at Scrooge out of a Gothic window in the wall, became invisible, and struck the hours and quarters in the clouds, with tremulous vibrations afterwards as if its teeth were chattering in its frozen head up there.",
  "words": [
    {
      "word": "temper",
      "signals": [
        "gloss-overlap"
      ]
    }
  ],
  "provenance": {
    "work": "A Christmas Carol",
    "author": "Charles Dickens",
    "year": 1843,
    "source": "Project Gutenberg #46",
    "url": "https://www.gutenberg.org/ebooks/46",
    "licence": "Public Domain (US: published before 1929)",
    "retrieved": "2026-07-25"
  },
  "topic": "city"
}
