{
  "id": "src-gen-little-lord-fauntleroy-002",
  "pool": "sourced",
  "text": "You see, I'm three days older than you, and that gives me a 'vantage. I'm three days older.” And this view of the case seemed to cheer Billy Williams so much that he began to smile on the world again, and felt able to swagger a little, almost as if he had won the race instead of losing it. Somehow, Ceddie Errol had a way of making people feel comfortable. Even in the first flush of his triumphs, he remembered that the person who was beaten might not feel so gay as he did, and might like to think that he MIGHT have been the winner under different circumstances. That morning Mr. Havisham had quite a long conversation with the winner of the race--a conversation which made him smile his dry smile, and rub his chin with his bony hand several times.",
  "words": [
    {
      "word": "cheer",
      "signals": [
        "gloss-overlap"
      ]
    }
  ],
  "provenance": {
    "work": "Little Lord Fauntleroy",
    "author": "Frances Hodgson Burnett",
    "year": 1886,
    "source": "Project Gutenberg #479",
    "url": "https://www.gutenberg.org/ebooks/479",
    "licence": "Public Domain (US: published before 1929)",
    "retrieved": "2026-07-25"
  },
  "topic": "childhood"
}
